{
  "$schema": "http://json-schema.org/draft-07/schema#",
  "title": "UI Event Log Schema",
  "type": "object",
  "properties": {
    "sessionId": {"type":"string", "format":"uuid"},
    "event": {"type":"string"},
    "payload": {"type":"object"},
    "timestamp": {"type":"string", "format":"date-time"}
  },
  "required":["sessionId","event","timestamp"]
}
